{"schema":"chancadem.model-metrics/v1","engine_version":"0.10.000","surrogate":{"n_train":6430,"n_test":2196,"test_seed":67890,"per_output":{"p80_mm":{"r2":0.997,"mape_pct":4.063,"mape_pct_int8":4.568},"p50_mm":{"r2":0.9947,"mape_pct":5.732,"mape_pct_int8":6.125},"p20_mm":{"r2":0.9886,"mape_pct":9.213,"mape_pct_int8":9.48},"pass_1":{"r2":0.9868,"mape_pct":8.115,"mape_pct_int8":8.329},"pass_4":{"r2":0.9884,"mape_pct":7.7,"mape_pct_int8":7.909},"pass_8":{"r2":0.993,"mape_pct":5.296,"mape_pct_int8":5.644},"pass_16":{"r2":0.9936,"mape_pct":5.293,"mape_pct_int8":5.538},"pass_32":{"r2":0.9971,"mape_pct":2.73,"mape_pct_int8":2.869},"throughput_tph":{"r2":0.9984,"mape_pct":5.017,"mape_pct_int8":5.434},"power_kw":{"r2":0.9792,"mape_pct":6.466,"mape_pct_int8":6.431}},"p80_monotone_vs_css":true,"parity":{"torch_vs_float32_max_abs":1.66893e-06,"float32_vs_int8_max_abs":0.234934},"note":"The surrogate emulates the canonical Python engine (a calibrated cheap physics model), not a real plant. Held-out is an independent second Latin-hypercube draw (seed 67890, 480 points per machine, degenerate draws dropped), not a split of the training draw. R2 and MAPE are in original units, computed through onnxruntime on the shipped float32 graph (MAPE also on the int8 graph). Parity is the maximum absolute difference of the standardised outputs on the held-out draw. torch_vs_float32 is the trained torch module against the exported float32 graph, measured by the train stage right after export, before the module was discarded, and carried in the surrogate contract (training.export_parity_max_abs); float32_vs_int8 is the float32 graph against the dynamically quantised one, measured here through onnxruntime. The int8 graph's worst standardised difference is larger, while its MAPE stays within about half a point of the float32 one. Monotonicity: P80 does not fall by more than 0.001 mm as CSS opens, on 15 curves (16 settings across each machine's range at the 25%, 50% and 75% points of its other inputs)."},"anomaly":{"n_heldout":2196,"false_alarm_rate":0.01,"n_planted":2196,"detection_rate":0.2796,"envelope_false_alarm_rate":0.0,"envelope_detection_rate":0.1389,"planted":"One planted point per held-out point, its operating inputs moved outside that machine's training range and then run through the engine: by held-out index modulo 18, one of the six continuous inputs (CSS, throw, speed, feed x63, feed m, ore A*b) moved above its upper bound by half the range width (patterns 0 to 5), one moved below its lower bound to half the bound (6 to 11), or two neighbouring inputs moved, the first above and the second below (12 to 17); ore_wi follows the A*b rule. Points whose engine result has a non-finite feature are left out.","note":"Alarm threshold: 0.24454 (the 99th percentile of the training scores); a score above it, or a non-finite score, is an alarm. The envelope gate is the engine's rule check (out_of_envelope): on the synthetic lane it flags only physically implausible inputs (CSS at or above F80, a non-positive CSS or feed size), so a point that is physically plausible but outside the training range passes it; the autoencoder scores distance from the training manifold, the complementary check."}}